,name,price,img
0,Apple iPhone 11 (64GB) - Black,"47,900",https://m.media-amazon.com/images/I/71i2XhHU3pL._AC_UY218_.jpg
1,Apple iPhone XR (64GB) - Black,"33,999",https://m.media-amazon.com/images/I/519KIlHA2wL._AC_UY218_.jpg
2,"Apple 20W USB-C Power Adapter (for iPhone, iPad & AirPods)","1,899",https://m.media-amazon.com/images/I/61vtLhO6fDL._AC_UY218_.jpg
3,"Apple MagSafe Charger (for iPhone, AirPods Pro, AirPods with Wireless Charging Case)","4,500",https://m.media-amazon.com/images/I/91Rh8F1g3kL._AC_UY218_.jpg
4,Apple AirPods Pro,"20,900",https://m.media-amazon.com/images/I/71zny7BTRlL._AC_UY218_.jpg
5,Apple iPhone XR (64GB) - Black,"33,999",https://m.media-amazon.com/images/I/519KIlHA2wL._AC_UY218_.jpg
6,Apple iPhone XR (64GB) - White,"33,999",https://m.media-amazon.com/images/I/51PuFBgBK4L._AC_UY218_.jpg
7,Apple iPhone XR (128GB) - White,"38,998",https://m.media-amazon.com/images/I/51PuFBgBK4L._AC_UY218_.jpg
8,Apple iPhone 11 (64GB) - Black,"47,900",https://m.media-amazon.com/images/I/71i2XhHU3pL._AC_UY218_.jpg
9,"New Apple Watch SE (GPS, 44mm) - Space Grey Aluminium Case with Black Sport Band","32,900",https://m.media-amazon.com/images/I/71rhrO49SmL._AC_UY218_.jpg
10,"New Apple Watch SE (GPS, 40mm) - Space Grey Aluminium Case with Black Sport Band","29,900",https://m.media-amazon.com/images/I/71bUKrOPzYL._AC_UY218_.jpg
11,"2020 Apple iPad Air with A14 Bionic chip (10.9-inch/27.69 cm, Wi-Fi, 64GB) - Sky Blue (4th Generation)","50,900",https://m.media-amazon.com/images/I/71dwvdUu72L._AC_UY218_.jpg
12,"Apple Magic Mouse (for Bluetooth-Enabled Mac with OS X 10.11 or Later, iPad with iPadOS 13.4 or Later)","7,532",https://m.media-amazon.com/images/I/61BZ5N9n4IL._AC_UY218_.jpg
13,New Apple AirTag,"3,190",https://m.media-amazon.com/images/I/71L5lSfJIPS._AC_UY218_.jpg
14,"Apple USB-C to Lightning Cable - 1m (for iPhone, iPad, MacBook, AirPods)","1,900",https://m.media-amazon.com/images/I/61QHx7l9ukL._AC_UY218_.jpg
15,New Apple AirPods Pro with MagSafe Charging Case,"24,900",https://m.media-amazon.com/images/I/71bhWgQK-cL._AC_UY218_.jpg
16,2021 Apple TV 4K (64GB) 2nd Generation,"20,408",https://m.media-amazon.com/images/I/815g8Uo656S._AC_UY218_.jpg
17,Mac_Keyboards_Magic Keyboard_2021_,"9,500",https://m.media-amazon.com/images/I/71cboO+0CcL._AC_UY218_.jpg
18,Apple Thunderbolt to Gigabit Ethernet Adapter,"2,699",https://m.media-amazon.com/images/I/31DxDApFzXL._AC_UY218_.jpg
19,"2021 Apple iPad Pro with Apple M1 chip (11-inch/27.96 cm, Wi-Fi + Cellular, 128GB) - Silver (3rd Generation)","83,500",https://m.media-amazon.com/images/I/817doxCSq7S._AC_UY218_.jpg
20,Airpod Pro with Wireless Charging Case | Active Noise Cancellation | Wireless Mobile Bluetooth |18 Hours Battery Backup | Compatible with Android & iOS Devices,"1,999",https://m.media-amazon.com/images/I/513VGdRsX2S._AC_UY218_.jpg
21,"Apple Watch Series 7 (GPS, 41mm) - (Product) RED Aluminium Case with (Product) RED Sport Band - Regular","41,900",https://m.media-amazon.com/images/I/71QR6f6Az6L._AC_UY218_.jpg
22,Apple EarPods with 3.5mm Headphone Plug,"1,900",https://m.media-amazon.com/images/I/410eivKV4DL._AC_UY218_.jpg
23,"Apple Watch Series 7 (GPS + Cellular, 41mm) - Blue Aluminium Case with Abyss Blue Sport Band - Regular","50,900",https://m.media-amazon.com/images/I/71zNES67uJL._AC_UY218_.jpg
24,"2020 Apple MacBook Pro (13.3-inch/33.78 cm, Apple M1 chip with 8‑core CPU and 8‑core GPU, 8GB RAM, 256GB SSD) - Space Grey","1,13,290",https://m.media-amazon.com/images/I/71an9eiBxpL._AC_UY218_.jpg
25,"Apple Watch SE (GPS, 40mm) - Gold Aluminium Case with Starlight Sport Band - Regular","29,900",https://m.media-amazon.com/images/I/71+FrNJ61dL._AC_UY218_.jpg
26,2021 Apple TV 4K (32GB) 2nd Generation,"18,900",https://m.media-amazon.com/images/I/815g8Uo656S._AC_UY218_.jpg
27,"2020 Apple MacBook Air (13.3-inch/33.78 cm, Apple M1 chip with 8‑core CPU and 7‑core GPU, 8GB RAM, 256GB SSD) - Gold","87,900",https://m.media-amazon.com/images/I/71vFKBpKakL._AC_UY218_.jpg
28,"New Apple Watch SE (GPS, 40mm) - Silver Aluminium Case with White Sport Band","29,900",https://m.media-amazon.com/images/I/71zaMJs757L._AC_UY218_.jpg
29,"SKSB GLG5 - Garlic, Lemon, Ginger, Apple Cider Vinegar, Honey Syrup 525 ml for Heart Blockages, Bad Cholesterol, High Blood Pressure, Arthritis, Constipation, Cough & Cold, Acidity etc.","1,650",https://m.media-amazon.com/images/I/51Gq6AO1bwL._AC_UY218_.jpg
30,Apple 67W USB-C Power Adapter (for MacBook),"5,900",https://m.media-amazon.com/images/I/51euVORJLFL._AC_UY218_.jpg
31,Apple Lightning to 3.5mm Audio Cable,"2,066",https://m.media-amazon.com/images/I/315AXxrFLfL._AC_UY218_.jpg
32,Apple Thunderbolt 3 (USB-C) Cable (0.8m),"3,499",https://m.media-amazon.com/images/I/41gZJbKW1ZL._AC_UY218_.jpg
33,"Beats Studio Buds – True Wireless Noise Cancelling Earbuds – IPX4 Rating, Sweat Resistant Earphones, Compatible with Apple & Android, Class 1 Bluetooth, Built-in Microphone – Black","12,990",https://m.media-amazon.com/images/I/51bRSWrEc7S._AC_UY218_.jpg
34,Apple iPhone XR (128GB) - (Product) RED,"38,999",https://m.media-amazon.com/images/I/51YXG1bDM5L._AC_UY218_.jpg
35,New Apple iPhone 12 Pro (128GB) - Pacific Blue,"97,900",https://m.media-amazon.com/images/I/71DVgBTdyLL._AC_UY218_.jpg
36,Apple Blossoms Multi Color Wet Free Diaper Bags,350,https://m.media-amazon.com/images/I/51JpxdtldjL._AC_UY218_.jpg
37,2021 Apple Siri Remote (2nd Generation),"5,800",https://m.media-amazon.com/images/I/61g-p-N8p+S._AC_UY218_.jpg
38,Apple Magic Keyboard with Touch ID and Numeric Keypad US English - Silver ((for Mac with Apple Silicon Running macOS 11.4 or Later),"17,500",https://m.media-amazon.com/images/I/71Yw0WfNfML._AC_UY218_.jpg
39,Apple Leather Case with MagSafe (for iPhone 13 Mini) - Golden Brown,"5,500",https://m.media-amazon.com/images/I/81L5duLCotL._AC_UY218_.jpg
40,Apple iPhone XR (64GB) - Coral,"33,999",https://m.media-amazon.com/images/I/51cCOStn+rL._AC_UY218_.jpg
41,Apple iPhone XR (128GB) - Black,"38,999",https://m.media-amazon.com/images/I/519KIlHA2wL._AC_UY218_.jpg
42,Apple AirTag Leather Key Ring - Forest Green,"3,590",https://m.media-amazon.com/images/I/71vH7wZ4NnS._AC_UY218_.jpg
43,Apple AirTag Leather Key Ring - Saddle Brown,"3,590",https://m.media-amazon.com/images/I/71fCQJFZLNS._AC_UY218_.jpg
44,Apple Watch Milanese Loop Band (40mm),"7,900",https://m.media-amazon.com/images/I/71NkoucqqtL._AC_UY218_.jpg
45,"Beats Studio Buds – True Wireless Noise Cancelling Earbuds – IPX4 Rating, Sweat Resistant Earphones, Compatible with Apple & Android, Class 1 Bluetooth, Built-in Microphone – Beats Red","14,499",https://m.media-amazon.com/images/I/51utxdpV8cS._AC_UY218_.jpg
46,Apple VESA Mount Adapter Kit (for iMac Pro) - Space Grey,"7,500",https://m.media-amazon.com/images/I/81rfV0kVDbL._AC_UY218_.jpg
47,Apple Watch Sport Band (40mm) - White - Regular,"3,898",https://m.media-amazon.com/images/I/61BODu6NfPL._AC_UY218_.jpg
48,"2020 Apple iPad Air with A14 Bionic chip (10.9-inch/27.69 cm, Wi-Fi, 64GB) - Space Grey (4th Generation)","49,490",https://m.media-amazon.com/images/I/71YxgZu73mL._AC_UY218_.jpg
49,Apple Silicone Case with MagSafe (for iPhone 13) - Blue Jay,"4,900",https://m.media-amazon.com/images/I/514h7q1c5PL._AC_UY218_.jpg
50,"Bharat's Real Apple Cider Vinegar, 250 Ml",160,https://m.media-amazon.com/images/I/71URkBdhMiL._AC_UY218_.jpg
51,White Apple Multi-Purpose Laptop Table with Dock Stand and Coffee Cup Holder/Study Table/Bed Table/Foldable and Portable/Ergonomic Table (New Black Table),318,https://m.media-amazon.com/images/I/81VWZ43nCfL._AC_UY218_.jpg
52,Apple TV HD (32GB),"15,900",https://m.media-amazon.com/images/I/61XiobVRcFS._AC_UY218_.jpg
53,Apple iPhone 11 (64GB) - (Product) RED,"47,900",https://m.media-amazon.com/images/I/71hh7cpWadL._AC_UY218_.jpg
54,JT Original Replacement Pencil Tips for Apple Pencil (Pack of 4) White,"3,199",https://m.media-amazon.com/images/I/413mjzaHMfL._AC_UY218_.jpg
55,Apple Watch Sport Band (44mm) - Grapefruit - Regular,"3,140",https://m.media-amazon.com/images/I/61mjwqgXsuL._AC_UY218_.jpg
56,"Apple Power Adapter Extension Cable (for MacBook Pro, MacBook, MacBook Air)","1,900",https://m.media-amazon.com/images/I/41nS9s1RhFL._AC_UY218_.jpg
57,Apple 80-AZ Battery for Car.,"7,000",https://m.media-amazon.com/images/I/81lJeQr2ZHL._AC_UY218_.jpg
58,Apple Clear Case with MagSafe (for iPhone 13 Pro Max),"4,900",https://m.media-amazon.com/images/I/61ZS6JjREML._AC_UY218_.jpg
59,Apple leaders Dust Cover for OEM TVS Platina DP5000,279,https://m.media-amazon.com/images/I/51S9IORGZzL._AC_UY218_.jpg
60,Apple Tree designer pearl and zircon Set (19 colors),449,https://m.media-amazon.com/images/I/81bBfsMCF0L._AC_UY218_.jpg
61,Apple Leather Case with MagSafe (for iPhone 13 Pro Max) - Midnight,"5,500",https://m.media-amazon.com/images/I/71HsMK5GXcL._AC_UY218_.jpg
62,"APPLE N95 PREMIUM WHITE Face Mask, Flat Fold mask, pollution mask, Dust mask with High Filteration Efficiency Pack of 2/10/20/50/100","1,150",https://m.media-amazon.com/images/I/71vBL2hQ0cL._AC_UY218_.jpg
63,Apple Leather Case with MagSafe (for iPhone 13 Pro Max) - Sequoia Green,"5,500",https://m.media-amazon.com/images/I/81klsR82-BL._AC_UY218_.jpg
64,"Adam's Apple Grandeur Collection, 230 g | Men's Grooming Gift Set | Natural Skincare | Made in India","1,299",https://m.media-amazon.com/images/I/71RVlBkxPaL._AC_UY218_.jpg
65,"New Apple Watch SE (GPS, 44mm) - Silver Aluminium Case with White Sport Band","32,900",https://m.media-amazon.com/images/I/71bVaoE6ElL._AC_UY218_.jpg
66,Apple USB-C to Magsafe 3 Cable -2m (for 2021 MacBook Pro),"4,900",https://m.media-amazon.com/images/I/717Nmm8sXEL._AC_UY218_.jpg
67,"Apple Leather Case with MagSafe (for iPhone 12, 12 Pro) - Saddle Brown","5,900",https://m.media-amazon.com/images/I/81r9e3gsyYL._AC_UY218_.jpg
68,Apple fun 2 in 1 Sea Creatures & Fruits Glittering Amazing Sand Kit,423,https://m.media-amazon.com/images/I/81pi72DDkpL._AC_UY218_.jpg
69,"HALLSTATT High grade 6.5mm thickness acrylic, elegant look keyboard stand with Scratch-Free Protector, crystal clear keyboard stand comfortable grip for keyboard typing, keyboard stand for desktop",699,https://m.media-amazon.com/images/I/312S+vuB7NL._AC_UY218_.jpg
70,Apple Pump Single Phase Horizontal OPENWELL Submersible Pumps,"17,999",https://m.media-amazon.com/images/I/21BQUKCDwJL._AC_UY218_.jpg
71,"Beats Flex Wireless Earphones – Apple W1 Headphone Chip, Magnetic Earbuds, Class 1 Bluetooth, 12 Hours of Listening Time, Built-in Microphone - Black","4,460",https://m.media-amazon.com/images/I/61rFK7dfbUL._AC_UY218_.jpg
72,Black Apple Stylishly Handcrafted Comfortable Men's Tan Formal Shoes PU Leather and Sweat Absorbing Comforter.,"1,099",https://m.media-amazon.com/images/I/41dNvImlaZL._AC_UY218_.jpg
73,"Beats Flex Wireless Earphones – Apple W1 Headphone Chip, Magnetic Earbuds, Class 1 Bluetooth, 12 Hours of Listening Time, Built-in Microphone - Grey","4,499",https://m.media-amazon.com/images/I/71PvN5ZJe2L._AC_UY218_.jpg
74,New Apple iPhone 12 Pro (128GB) - Graphite,"95,900",https://m.media-amazon.com/images/I/71YlH-4MUQL._AC_UY218_.jpg
75,Apple Lightning to SD Card Camera Reader,"2,200",https://m.media-amazon.com/images/I/41Yebb23I+L._AC_UY218_.jpg
76,Apple iPod Touch (128GB) - Blue (Latest Model),"29,600",https://m.media-amazon.com/images/I/61Rnl5vdjKL._AC_UY218_.jpg
77,"HEALTHY APPLE Masala (Pav Bhaji Masala, 150 Gm)",290,https://m.media-amazon.com/images/I/71JFeLk1PdL._AC_UY218_.jpg
78,"Apple Leather Case with MagSafe (for iPhone 12, 12 Pro) - Deep Violet","5,900",https://m.media-amazon.com/images/I/81wlb5eCrOS._AC_UY218_.jpg
79,Apple iPhone 11 (64GB) - Yellow,"47,900",https://m.media-amazon.com/images/I/714Mg+6MoFL._AC_UY218_.jpg
80,Apple Blossoms Reusable Baby Cloth Diapers-Combo Pack- 3 Pocket Style Diapers +6 Organic Cotton Inserts and Dry Feel (Multicolor),"1,100",https://m.media-amazon.com/images/I/51nvShc-M2L._AC_UY218_.jpg
81,"Apple Clear Case with Magsafe (for iPhone 12, 12 Pro)","4,900",https://m.media-amazon.com/images/I/71SajyozvNL._AC_UY218_.jpg
82,Apple iPhone XR (128GB) - Blue,"38,999",https://m.media-amazon.com/images/I/51n24DedexL._AC_UY218_.jpg
83,White Apple Smart Standard Multi-Purpose Laptop Table with Dock Stand/Study Table/Bed Table/Foldable and Portable/Ergonomic & Rounded Edges/Non-Slip Legs/Engineered,319,https://m.media-amazon.com/images/I/41fKN06qF8L._AC_UY218_.jpg
84,Apple Leather Case with MagSafe (for iPhone 13 Pro) - Golden Brown,"5,500",https://m.media-amazon.com/images/I/81VID6nBSkL._AC_UY218_.jpg
85,Apple Leather Case with MagSafe (for iPhone 13) - Midnight,"5,500",https://m.media-amazon.com/images/I/81FUj+NRuLL._AC_UY218_.jpg
86,Apple Magic Keyboard with Touch ID - US English - Silver (for Mac with Apple Silicon Running macOS 11.4 or Later),"14,500",https://m.media-amazon.com/images/I/71vwNsgEi8L._AC_UY218_.jpg
87,"2020 Apple MacBook Pro (13.3-inch/33.78 cm, 16GB RAM, 1TB SSD, 2.0GHz Quad-core 10th-Generation Intel Core i5 Processor, Four Thunderbolt 3 Ports) - Silver","1,69,990",https://m.media-amazon.com/images/I/716R-UhEB+L._AC_UY218_.jpg
88,New Apple iPhone 12 Pro (256GB) - Pacific Blue,"1,02,900",https://m.media-amazon.com/images/I/71DVgBTdyLL._AC_UY218_.jpg
89,"2020 Apple MacBook Pro (13.3-inch/33.78 cm, 16GB RAM, 1TB SSD, 2.0GHz Quad-core 10th-Generation Intel Core i5 Processor, Four Thunderbolt 3 Ports) - Silver","1,69,990",https://m.media-amazon.com/images/I/716R-UhEB+L._AC_UY218_.jpg
90,Apple iPhone XR (64GB) - Yellow,"33,999",https://m.media-amazon.com/images/I/519Wcu07etL._AC_UY218_.jpg
91,Apple Watch Milanese Loop (40mm) - Gold,"7,900",https://m.media-amazon.com/images/I/61fb2Lwu2iL._AC_UY218_.jpg
92,Apple Watch Leather Loop (44mm) - Diver Blue - Large,"7,900",https://m.media-amazon.com/images/I/51ySRwYhLvL._AC_UY218_.jpg
93,Apple Leather Case with MagSafe (for iPhone 13 Pro Max) - Golden Brown,"5,500",https://m.media-amazon.com/images/I/81NfGxYOyZL._AC_UY218_.jpg
94,"Apple Watch SE (GPS + Cellular, 44mm) - Space Grey Aluminium Case with Tornado/Grey Sport Loop","36,900",https://m.media-amazon.com/images/I/81KKiBQNouL._AC_UY218_.jpg
95,"Apple Magic Keyboard for iPad Pro 12.9‑inch (3rd, 4th & 5th Generation) - White","31,900",https://m.media-amazon.com/images/I/81UDF62AqHS._AC_UY218_.jpg
96,"Apple Silicone Case with MagSafe (for iPhone 12, 12 Pro) - Plum","4,900",https://m.media-amazon.com/images/I/712ScsERk-L._AC_UY218_.jpg
97,"Apple Watch SE (GPS, 40mm) - Space Grey Aluminium Case with Midnight Sport Band - Regular","29,900",https://m.media-amazon.com/images/I/71Pln-8awPL._AC_UY218_.jpg
98,"2021 Apple iPad Pro with Apple M1 chip (11-inch/27.96 cm, Wi-Fi + Cellular, 128GB) - Space Grey (3rd Generation)","83,500",https://m.media-amazon.com/images/I/81a-rN2A3DS._AC_UY218_.jpg
99,Apple Watch Sport Loop (41mm) - Pink Pomelo/Tan - Regular,"3,900",https://m.media-amazon.com/images/I/71Ez4T8BZlL._AC_UY218_.jpg
100,"Beats Flex Wireless Earphones – Apple W1 Headphone Chip, Magnetic Earbuds, Class 1 Bluetooth, 12 Hours of Listening Time, Built-in Microphone - Blue","4,499",https://m.media-amazon.com/images/I/61ORqF987ZL._AC_UY218_.jpg
101,Healthy Apple Honey (Wild Forest),299,https://m.media-amazon.com/images/I/71sMraUaZ5L._AC_UY218_.jpg
102,Apple Leather Case with MagSafe (for iPhone 12 Pro Max) - Saddle Brown,"5,900",https://m.media-amazon.com/images/I/81yn2spHqML._AC_UY218_.jpg
103,"New Apple Watch SE (GPS + Cellular, 44mm) - Space Grey Aluminium Case with Black Sport Band","36,900",https://m.media-amazon.com/images/I/712P1s+NPAL._AC_UY218_.jpg
104,"2020 Apple Mac Mini (Apple M1 chip with 8‑core CPU and 8‑core GPU, 8GB RAM, 256GB SSD) -Silver","61,990",https://m.media-amazon.com/images/I/71pcTYT+ICL._AC_UY218_.jpg
105,Apple Leather Sleeve with MagSafe (for iPhone 12 Mini) - (Product) RED,"4,345",https://m.media-amazon.com/images/I/71tN6ylWBkL._AC_UY218_.jpg
106,Apple 165-AZ Battery for Car.,"9,500",https://m.media-amazon.com/images/I/71OURG+fxEL._AC_UY218_.jpg
107,New Apple iPhone 12 Pro (128GB) - Gold,"97,900",https://m.media-amazon.com/images/I/71cSV-RTBSL._AC_UY218_.jpg
108,Apple Silicone Case with MagSafe (for iPhone 12 Pro Max) - Black,"4,900",https://m.media-amazon.com/images/I/617K2NwVHML._AC_UY218_.jpg
109,Apple Lightning to 3.5mm Audio Cable (1.2m) - White,"2,372",https://m.media-amazon.com/images/I/61Ski0jm1nL._AC_UY218_.jpg
110,"Apple Silicone Case with MagSafe (for iPhone 12, 12 Pro) - Capri Blue","4,900",https://m.media-amazon.com/images/I/51JSF1bUptS._AC_UY218_.jpg
111,Apple Tree Glass Bangles set Studded with Stones and Zircon (Set of 24 bangles) 17 colors,459,https://m.media-amazon.com/images/I/81oLsXupo3L._AC_UY218_.jpg
112,Apple Leather Case with MagSafe (for iPhone 13 Pro) - Sequoia Green,"5,500",https://m.media-amazon.com/images/I/81w1rSudgOL._AC_UY218_.jpg
113,"2021 Apple iPad Pro with Apple M1 chip (11-inch/27.96 cm, Wi-Fi + Cellular, 256GB) - Space Grey (3rd Generation)","91,900",https://m.media-amazon.com/images/I/81a-rN2A3DS._AC_UY218_.jpg
114,"Apple iMac (21.5-inch/54.61 cm, 8GB RAM, 2.3GHz Dual-core 7th-Generation Intel Core i5 Processor, 256GB SSD Storage) - Silver","93,990",https://m.media-amazon.com/images/I/81XI2xLLjYL._AC_UY218_.jpg
115,Apple iPod Touch (32GB) - Space Grey (Latest Model),"19,600",https://m.media-amazon.com/images/I/61uVbebKlGL._AC_UY218_.jpg
116,Apple Leather Wallet with MagSafe (for iPhone) - Wisteria,"5,500",https://m.media-amazon.com/images/I/81iCBdq769L._AC_UY218_.jpg
117,Apple AirTag Leather Key Ring - Baltic Blue,"3,590",https://m.media-amazon.com/images/I/71-0jzh0LYS._AC_UY218_.jpg
118,"2020 Apple iPad Air with A14 Bionic chip (10.9-inch/27.69 cm, Wi-Fi + Cellular, 256GB) - Sky Blue (4th Generation)","80,900",https://m.media-amazon.com/images/I/71kFzFbiINL._AC_UY218_.jpg
119,Apple Leaders Dust Cover for Epson L6170 Printer (Black),271,https://m.media-amazon.com/images/I/51WpD0PpPkL._AC_UY218_.jpg
120,Apple Silicone Case with MagSafe (for iPhone 13 Pro) - Midnight,"4,900",https://m.media-amazon.com/images/I/61CyxSFKNdL._AC_UY218_.jpg
121,APPLE LEADERS Printer DUST Cover Compatible for HP Smart Tank 516 Wireless All-in-One Black,345,https://m.media-amazon.com/images/I/51nitLzFQrL._AC_UY218_.jpg
122,Apple AirTag Leather Key Ring - (Product) RED,"3,302",https://m.media-amazon.com/images/I/71Sn4HE3cLS._AC_UY218_.jpg
123,Mac Apple 300 Pcs Transparent Disposable Clear Plastic Hand Gloves,195,https://m.media-amazon.com/images/I/417hZOKKVDL._AC_UY218_.jpg
124,New Apple iPhone 12 Pro Max (512GB) - Pacific Blue with Apple AirPods Pro,"1,70,800",https://m.media-amazon.com/images/I/71KkYat7muL._AC_UY218_.jpg
125,Apple Blossoms - Reusable Baby Cloth Diaper- Organic Cotton Insert - Pack of 3,675,https://m.media-amazon.com/images/I/61t20uvi-iL._AC_UY218_.jpg
126,Apple Silicone Case (for iPhone 11 Pro) - Black,"3,500",https://m.media-amazon.com/images/I/616QHIJT-PL._AC_UY218_.jpg
127,Apple Silicone Case with MagSafe (for iPhone 13 Pro Max) - Midnight,"4,900",https://m.media-amazon.com/images/I/51aJYhtgVkL._AC_UY218_.jpg
128,New Apple iPhone 12 Pro Max (256GB) - Gold,"1,29,900",https://m.media-amazon.com/images/I/71fJ-gmBZtL._AC_UY218_.jpg
129,"61W USB-C Adaptor Power Charger Adapter for 13"" inch A1718 A1706 A1708 Type C Cable Included White","5,499",https://m.media-amazon.com/images/I/312CKxybpHL._AC_UY218_.jpg
130,"Apple Watch SE (GPS, 44mm) - Space Grey Aluminium Case with Midnight Sport Band - Regular","32,900",https://m.media-amazon.com/images/I/71nZ497gYtL._AC_UY218_.jpg
131,New Apple iPhone 12 Pro (512GB) - Silver,"1,12,900",https://m.media-amazon.com/images/I/71xkMA+gvYL._AC_UY218_.jpg
132,"Apple Barrel Acrylic Paint (8 Ounce), Pink Parfait, 8 Fl Oz","1,943",https://m.media-amazon.com/images/I/71JwNekdDSL._AC_UY218_.jpg
133,"Apple Silicone Case with MagSafe (for iPhone 12, 12 Pro - Cloud Blue","4,900",https://m.media-amazon.com/images/I/511BXdWnKlS._AC_UY218_.jpg
134,"Adam's Apple | Coffee Face & Body Scrub | 100g | Natural | De-Tan | Honey, Argan Oil, Kaolin Clay | Paraben & SLS Free | Made in India",350,https://m.media-amazon.com/images/I/61iHanHPUYL._AC_UY218_.jpg
135,Healthy Apple Kaju - 320 - 500 Gms,389,https://m.media-amazon.com/images/I/51ZK7JbHkaS._AC_UY218_.jpg
136,"Beats Flex Wireless Earphones – Apple W1 Headphone Chip, Magnetic Earbuds, Class 1 Bluetooth, 12 Hours of Listening Time, Built-in Microphone - Yellow","4,499",https://m.media-amazon.com/images/I/51JPEkpWOCL._AC_UY218_.jpg
137,Apple Leather Case with MagSafe (for iPhone 13 Pro Max) - Dark Cherry,"5,500",https://m.media-amazon.com/images/I/81+DfeIRTkL._AC_UY218_.jpg
138,"Black Apple DS-536 Laser Black Formal Shoes, Handcrafted, Comfortable Derby, Light Weight, PU Sole, Sweat Absorbing Comforter, Regular Wear for Work and Parties","1,299",https://m.media-amazon.com/images/I/81azwAFq4qL._AC_UY218_.jpg
139,New Apple AirTag 4 Pack,"10,900",https://m.media-amazon.com/images/I/71L5lSfJIPS._AC_UY218_.jpg
140,Apple Leather Case with MagSafe (for iPhone 13 Mini) - Midnight,"5,500",https://m.media-amazon.com/images/I/71AKxTK2raL._AC_UY218_.jpg
141,Apple leaders Printer Dust Cover for Epson M100 Printer Black,271,https://m.media-amazon.com/images/I/51WpD0PpPkL._AC_UY218_.jpg
142,Apple Silicone Case with MagSafe (for iPhone 13 Pro) - Clover,"4,900",https://m.media-amazon.com/images/I/61MQRhYiHuL._AC_UY218_.jpg
143,Apple AirTag Leather Loop - Saddle Brown,"3,386",https://m.media-amazon.com/images/I/71LLm1L8QmS._AC_UY218_.jpg
144,ottavio Mouse Trap/Rat Trap,799,https://m.media-amazon.com/images/I/517pUq8UViL._AC_UY218_.jpg
145,"Apple Watch SE (GPS, 44mm) - Gold Aluminium Case with Starlight Sport Band - Regular","32,900",https://m.media-amazon.com/images/I/712wRLMlBeL._AC_UY218_.jpg
146,Apple Leather Wallet with MagSafe (for iPhone) - Baltic Blue,"5,900",https://m.media-amazon.com/images/I/81QXg3r+AUL._AC_UY218_.jpg
147,"2019 Apple iPad mini with A12 Bionic chip (7.9-inch/20.1 cm, Wi‑Fi + Cellular, 64GB) - Silver (5th Generation)","45,900",https://m.media-amazon.com/images/I/81L5G4-sniL._AC_UY218_.jpg
148,Apple Leather Wallet with MagSafe (for iPhone) - Sequoia Green,"5,500",https://m.media-amazon.com/images/I/81SMRrWfJbL._AC_UY218_.jpg
149,Apple Pie Boys Hoodie Set with Jogger Pant,549,https://m.media-amazon.com/images/I/71+rm5S1NxL._AC_UY218_.jpg
150,New Apple iPhone 12 Pro (128GB) - Gold with Apple 20W USB-C Power Adapter,"99,799",https://m.media-amazon.com/images/I/71GEulph6ML._AC_UY218_.jpg
151,Apple Leather Case with MagSafe (for iPhone 12 Pro Max) - Baltic Blue,"5,900",https://m.media-amazon.com/images/I/81rOU14bUjL._AC_UY218_.jpg
152,"2021 Apple iPad Pro with Apple M1 chip (12.9-inch/32.77 cm, Wi-Fi, 256GB) - Silver (5th Generation)","1,08,900",https://m.media-amazon.com/images/I/815KnP2wjDS._AC_UY218_.jpg
153,"2020 Apple iPad Air with A14 Bionic chip (10.9-inch/27.69 cm, Wi-Fi, 256GB) - Silver (4th Generation)","63,900",https://m.media-amazon.com/images/I/714o0MLzl0L._AC_UY218_.jpg
154,Apple Watch Leather Link (40mm) - Chalk - Small/Medium,"7,900",https://m.media-amazon.com/images/I/51bByXg6bxL._AC_UY218_.jpg
155,"2020 Apple iPad Air with A14 Bionic chip (10.9-inch/27.69 cm, Wi-Fi, 256GB) - Rose Gold (4th Generation)","68,900",https://m.media-amazon.com/images/I/71uiwxeUiZL._AC_UY218_.jpg
156,"2020 Apple iPad Air with A14 Bionic chip (10.9-inch/27.69 cm, Wi-Fi + Cellular, 256GB) - Silver (4th Generation)","80,900",https://m.media-amazon.com/images/I/71-mJuQew-L._AC_UY218_.jpg
157,Apple Watch Leather Link (45mm) - Dark Cherry - M/L,"7,900",https://m.media-amazon.com/images/I/618oT0d36vL._AC_UY218_.jpg
158,Apple Leather Case with MagSafe (for iPhone 13 Pro Max) - Wisteria,"5,500",https://m.media-amazon.com/images/I/81MCN+GPtcL._AC_UY218_.jpg
159,Apple Smart Cover (for iPad Mini) - Papaya,"2,494",https://m.media-amazon.com/images/I/4162oklCXnL._AC_UY218_.jpg
160,Apple Silicone Case with MagSafe (for iPhone 12 Pro Max) - Deep Navy,"4,900",https://m.media-amazon.com/images/I/61iKvUuUV5L._AC_UY218_.jpg
161,Apple Smart Folio for 10.9-inch iPad Air (4th Generation) - Mallard Green,"7,500",https://m.media-amazon.com/images/I/31hbQdMDMqS._AC_UY218_.jpg
162,Healthy Apple Kaju - 320 - 250 Gms,362,https://m.media-amazon.com/images/I/51NKRevYrYS._AC_UY218_.jpg
163,"2020 Apple iPad Air with A14 Bionic chip (10.9-inch/27.69 cm, Wi-Fi, 256GB) - Sky Blue (4th Generation)","63,900",https://m.media-amazon.com/images/I/71dwvdUu72L._AC_UY218_.jpg
164,Apple Thunderbolt cable (2.0 m),"3,900",https://m.media-amazon.com/images/I/41ewYPoH2nL._AC_UY218_.jpg
165,Apple Silicone Case with MagSafe (for iPhone 12 Pro Max) - (Product) RED,"3,780",https://m.media-amazon.com/images/I/6154ZbwZJxL._AC_UY218_.jpg
166,"Orange & Apple, Extra Bite 50gm",200,https://m.media-amazon.com/images/I/5156BUL2duS._AC_UY218_.jpg
167,Apple AirTag Loop - White,"2,572",https://m.media-amazon.com/images/I/513VWlMb0ZS._AC_UY218_.jpg
168,Apple tree Red Glass Bangles with Golden stone (Pack of 12),299,https://m.media-amazon.com/images/I/71MdEBMCsgL._AC_UY218_.jpg
169,Apple Smart Keyboard for iPad (7th & 8th Generation) - Black,"13,900",https://m.media-amazon.com/images/I/71mava1GE1L._AC_UY218_.jpg
170,Apple Blossoms Cotton Fabric Reusable Pant Style Diapers with Stay Dry Layer Large (2-3 Year) (Bold Chevron),406,https://m.media-amazon.com/images/I/41hBm+HSzzL._AC_UY218_.jpg
171,Apple 100-AZ Battery for Car.,"7,500",https://m.media-amazon.com/images/I/71zP4HMeaYL._AC_UY218_.jpg
172,Apple Silicone Case with MagSafe (for iPhone 13) - Chalk Pink,"4,900",https://m.media-amazon.com/images/I/51QAxG+QyLL._AC_UY218_.jpg
173,New Apple iPhone 12 Pro (512GB) - Gold,"1,12,900",https://m.media-amazon.com/images/I/71cSV-RTBSL._AC_UY218_.jpg
174,New Apple iPhone 12 Pro (128GB) - Silver,"99,900",https://m.media-amazon.com/images/I/71xkMA+gvYL._AC_UY218_.jpg
175,Apple Smart Folio (for 12.9-inch iPad Pro) - English Lavender,"9,052",https://m.media-amazon.com/images/I/51sU3PaCzcL._AC_UY218_.jpg
